{
  "id": "nr_coruscant_04_senate_exposure",
  "factionId": "new_republic",
  "questType": "main",
  "title": "Exposing the Senate",
  "description": "You have all the evidence you need to expose Senator Vorin. But he's powerful, connected, and won't go down without a fight. The Corporate Sector owns half the Senate, and they own him. Exposing him means exposing them. This is bigger than you realized. But the truth must come out, and corruption must be exposed. The New Republic's future depends on it.",
  "shortDescription": "Confront and expose Senator Vorin in the Senate",
  "prerequisites": {
    "level": 8,
    "reputation": {
      "new_republic": 70
    },
    "completedQuests": ["nr_coruscant_03_underworld_connection"],
    "items": ["corruption_evidence", "bribery_records", "underworld_evidence"]
  },
  "objectives": [
    {
      "id": "confront_senator",
      "type": "interact",
      "description": "Confront Senator Vorin with the evidence",
      "target": "npc_corrupt_senator"
    },
    {
      "id": "defeat_senator",
      "type": "defeat",
      "description": "Defeat Senator Vorin and his guards",
      "target": "npc_corrupt_senator",
      "count": 1
    },
    {
      "id": "recover_assets",
      "type": "collect",
      "description": "Recover the senator's assets as evidence",
      "target": "senator_assets",
      "count": 1
    },
    {
      "id": "present_evidence",
      "type": "custom",
      "description": "Present evidence to the Senate (or keep it for yourself)",
      "target": "senate_presentation"
    }
  ],
  "rewards": {
    "xp": 3000,
    "credits": 5000,
    "reputation": {
      "new_republic": 100,
      "corporate_sector": -50
    },
    "items": [
      {
        "itemId": "senate_commendation",
        "quantity": 1
      },
      {
        "itemId": "senator_assets",
        "quantity": 1
      }
    ],
    "unlocks": []
  },
  "questGiverId": "npc_senator_aide",
  "startLocation": {
    "planet": "coruscant",
    "area": "senate_district"
  },
  "estimatedTime": 120,
  "difficulty": "very_hard",
  "isActive": true,
  "chainId": "nr_coruscant_corruption_chain",
  "chainOrder": 3
}



