{
  "id": "tatooine_side_01_lars_homestead",
  "factionId": "jedi_seekers",
  "questType": "side",
  "title": "The Lars Homestead",
  "description": "Professor Aris Thorne, a historian fascinated by the Skywalker legacy, wants to investigate the abandoned Lars Homestead. It's one of the most significant historical sites on Tatooine—the place where Luke Skywalker grew up. The local authorities won't allow official exploration, but if someone were to investigate independently, the professor would pay well for any historical artifacts or information found.",
  "shortDescription": "Investigate the Lars Homestead for historical artifacts",
  "prerequisites": {
    "level": 3,
    "reputation": {},
    "completedQuests": [],
    "items": []
  },
  "objectives": [
    {
      "id": "meet_historian",
      "type": "interact",
      "description": "Speak with Professor Aris Thorne about the Lars Homestead",
      "target": "npc_local_historian"
    },
    {
      "id": "travel_homestead",
      "type": "travel",
      "description": "Travel to the Lars Homestead",
      "location": {
        "planet": "tatooine",
        "area": "jundland_wastes"
      }
    },
    {
      "id": "investigate_homestead",
      "type": "discover",
      "description": "Investigate the homestead for historical artifacts",
      "evidenceId": "evidence_lars_homestead"
    },
    {
      "id": "recover_datapad",
      "type": "collect",
      "description": "Recover Skywalker family datapad",
      "target": "skywalker_datapad",
      "count": 1
    },
    {
      "id": "return_to_historian",
      "type": "deliver",
      "description": "Return the datapad to Professor Thorne",
      "target": "npc_local_historian"
    }
  ],
  "rewards": {
    "xp": 800,
    "credits": 500,
    "reputation": {
      "jedi_seekers": 25
    },
    "items": [
      {
        "itemId": "skywalker_datapad",
        "quantity": 1
      }
    ],
    "unlocks": []
  },
  "questGiverId": "npc_local_historian",
  "startLocation": {
    "planet": "tatooine",
    "area": "mos_eisley"
  },
  "estimatedTime": 60,
  "difficulty": "medium",
  "isActive": true,
  "chainId": null,
  "chainOrder": null
}



