{
  "id": "nr_dantooine_04_imperial_threat",
  "factionId": "new_republic",
  "questType": "main",
  "title": "Imperial Remnant Threat",
  "description": "The intelligence recovered from the base reveals that Imperial Remnant forces are operating on Dantooine. Commander Thorne, a Remnant commander, has been trying to recover the same intelligence. The New Republic cannot allow the Remnant to gain this information. You must confront Commander Thorne and stop the Remnant operation.",
  "shortDescription": "Confront and stop the Imperial Remnant operation on Dantooine",
  "prerequisites": {
    "level": 7,
    "reputation": {
      "new_republic": 50
    },
    "completedQuests": ["nr_dantooine_01_abandoned_base"],
    "items": ["rebel_datapads"]
  },
  "objectives": [
    {
      "id": "investigate_remnant",
      "type": "discover",
      "description": "Investigate Imperial Remnant activity",
      "evidenceId": "evidence_remnant_activity"
    },
    {
      "id": "obtain_report",
      "type": "collect",
      "description": "Obtain Imperial activity report",
      "target": "imperial_report",
      "count": 1
    },
    {
      "id": "confront_commander",
      "type": "interact",
      "description": "Confront Commander Thorne",
      "target": "npc_imperial_commander_dantooine"
    },
    {
      "id": "defeat_commander",
      "type": "defeat",
      "description": "Defeat Commander Thorne and his forces",
      "target": "npc_imperial_commander_dantooine",
      "count": 1
    },
    {
      "id": "secure_area",
      "type": "custom",
      "description": "Secure the area and ensure Remnant forces are driven out",
      "target": "area_secured"
    }
  ],
  "rewards": {
    "xp": 2500,
    "credits": 2000,
    "reputation": {
      "new_republic": 75,
      "imperial_remnant": -50
    },
    "items": [
      {
        "itemId": "imperial_report",
        "quantity": 1
      }
    ],
    "unlocks": []
  },
  "questGiverId": "npc_nr_intel_officer",
  "startLocation": {
    "planet": "dantooine",
    "area": "base_region"
  },
  "estimatedTime": 120,
  "difficulty": "very_hard",
  "isActive": true,
  "chainId": "nr_dantooine_base_chain",
  "chainOrder": 2
}



