{
  "id": "sg_tatooine_race_01_registration",
  "factionId": "smugglers_guild",
  "questType": "side",
  "title": "Beggar's Canyon Championship",
  "description": "Rex 'Speed' Danner is organizing the biggest swoop race on Tatooine—the Beggar's Canyon Championship. Pilots from across the Outer Rim will compete for a prize of 10,000 credits and a custom-built swoop bike. But Beggar's Canyon is no joke—it's dangerous, and many pilots have died trying to master it. Do you have what it takes?",
  "shortDescription": "Compete in the Beggar's Canyon swoop race championship",
  "prerequisites": {
    "level": 4,
    "reputation": {},
    "completedQuests": [],
    "items": []
  },
  "objectives": [
    {
      "id": "meet_organizer",
      "type": "interact",
      "description": "Speak with race organizer Rex Danner",
      "target": "npc_race_organizer"
    },
    {
      "id": "register_race",
      "type": "custom",
      "description": "Register for the Beggar's Canyon Championship",
      "target": "race_registration"
    },
    {
      "id": "obtain_badge",
      "type": "collect",
      "description": "Obtain race entry badge",
      "target": "race_badge",
      "count": 1
    },
    {
      "id": "complete_race",
      "type": "custom",
      "description": "Complete the Beggar's Canyon race (finish in top 3 to win)",
      "target": "race_completion"
    }
  ],
  "rewards": {
    "xp": 1500,
    "credits": 10000,
    "reputation": {
      "smugglers_guild": 50
    },
    "items": [
      {
        "itemId": "championship_trophy",
        "quantity": 1
      },
      {
        "itemId": "custom_swoop",
        "quantity": 1
      }
    ],
    "unlocks": []
  },
  "questGiverId": "npc_race_organizer",
  "startLocation": {
    "planet": "tatooine",
    "area": "mos_eisley"
  },
  "estimatedTime": 90,
  "difficulty": "hard",
  "isActive": true,
  "chainId": null,
  "chainOrder": null
}



