{
  "id": "coruscant_side_02_senate_lobbying",
  "factionId": "new_republic",
  "questType": "side",
  "title": "Senate Lobbying",
  "description": "A senator or corporate representative needs help influencing a Senate vote on an important bill. It's all perfectly legal—just strategic conversations, a few favors called in. The New Republic runs on relationships, and they need someone who understands that. Can you help ensure the right outcome?",
  "shortDescription": "Help influence a Senate vote through political maneuvering",
  "prerequisites": {
    "level": 5,
    "reputation": {},
    "completedQuests": [],
    "items": []
  },
  "objectives": [
    {
      "id": "meet_lobbyist",
      "type": "interact",
      "description": "Meet with the senator/lobbyist",
      "target": "npc_senate_lobbyist"
    },
    {
      "id": "gather_support",
      "type": "custom",
      "description": "Gather support for the bill through conversations and favors",
      "target": "senate_support",
      "count": 5
    },
    {
      "id": "influence_vote",
      "type": "custom",
      "description": "Successfully influence the Senate vote",
      "target": "vote_influence"
    }
  ],
  "rewards": {
    "xp": 1000,
    "credits": 1500,
    "reputation": {
      "new_republic": 30
    },
    "items": [
      {
        "itemId": "political_favor",
        "quantity": 1
      }
    ],
    "unlocks": []
  },
  "questGiverId": "npc_senate_lobbyist",
  "startLocation": {
    "planet": "coruscant",
    "area": "senate_district"
  },
  "estimatedTime": 60,
  "difficulty": "medium",
  "isActive": true,
  "chainId": null,
  "chainOrder": null
}



