{
  "id": "iia_ryloth_03_refugee_liberation",
  "factionId": "independent_investigators",
  "questType": "main",
  "title": "Refugee Liberation",
  "description": "With evidence of the connection between the mines and Compound 7-Alpha, the refugees are in even greater danger. The syndicate knows they're talking, and they won't hesitate to silence them. Lira Tann, the refugee leader, needs help getting her people to safety. Help them secure transport, supplies, and protection to escape Ryloth and find a new home.",
  "shortDescription": "Help the refugees escape Ryloth and find safety",
  "prerequisites": {
    "level": 5,
    "reputation": {
      "independent_investigators": 95
    },
    "completedQuests": ["iia_ryloth_02_mines_investigation"],
    "items": ["mine_foreman_datapad"]
  },
  "objectives": [
    {
      "id": "speak_refugee_leader",
      "type": "interact",
      "description": "Speak with Lira Tann about the refugees' situation",
      "target": "npc_refugee_leader"
    },
    {
      "id": "secure_transport",
      "type": "custom",
      "description": "Secure transport for the refugees (negotiate with smugglers or New Republic)",
      "target": "transport_negotiation"
    },
    {
      "id": "gather_supplies",
      "type": "collect",
      "description": "Gather supplies for the refugees (rations, medpacs, credits)",
      "target": "supplies",
      "count": 10
    },
    {
      "id": "protect_refugees",
      "type": "defeat",
      "description": "Defeat syndicate thugs attacking the refugee camp",
      "target": "syndicate_thug",
      "count": 5
    },
    {
      "id": "evacuate_refugees",
      "type": "custom",
      "description": "Successfully evacuate the refugees from Ryloth",
      "target": "refugee_evacuation"
    }
  ],
  "rewards": {
    "xp": 1500,
    "credits": 1000,
    "reputation": {
      "independent_investigators": 50,
      "outer_rim_settlers": 25
    },
    "items": [
      {
        "itemId": "refugee_gratitude",
        "quantity": 1
      }
    ],
    "unlocks": ["iia_ryloth_04_syndicate_exposure"]
  },
  "questGiverId": "npc_refugee_leader",
  "startLocation": {
    "planet": "ryloth",
    "area": "tann_province"
  },
  "estimatedTime": 90,
  "difficulty": "hard",
  "isActive": true,
  "chainId": "iia_main_chain",
  "chainOrder": 4
}



