{
  "id": "dantooine_side_01_kinrath_menace",
  "factionId": "outer_rim_settlers",
  "questType": "side",
  "title": "The Kinrath Menace",
  "description": "Jorn Kess, a farmer in the Dantooine settlement, is desperate for help. The kinrath creatures have been getting bolder, coming closer to the settlement and attacking farms. Last week, they attacked one of the farms, and the settlers are afraid. They're not fighters, but they can't just abandon their homes. Can you help clear out the kinrath nest?",
  "shortDescription": "Clear out the kinrath nest threatening the settlement",
  "prerequisites": {
    "level": 4,
    "reputation": {},
    "completedQuests": [],
    "items": []
  },
  "objectives": [
    {
      "id": "speak_farmer",
      "type": "interact",
      "description": "Speak with farmer Jorn Kess about the kinrath problem",
      "target": "npc_dantooine_farmer"
    },
    {
      "id": "locate_nest",
      "type": "travel",
      "description": "Locate the kinrath nest near the settlement",
      "location": {
        "planet": "dantooine",
        "area": "wilderness"
      }
    },
    {
      "id": "defeat_kinrath",
      "type": "defeat",
      "description": "Defeat the kinrath creatures in the nest",
      "target": "kinrath",
      "count": 8
    },
    {
      "id": "clear_nest",
      "type": "custom",
      "description": "Clear out the kinrath nest completely",
      "target": "nest_cleared"
    },
    {
      "id": "return_to_farmer",
      "type": "interact",
      "description": "Return to Jorn Kess to report success",
      "target": "npc_dantooine_farmer"
    }
  ],
  "rewards": {
    "xp": 1000,
    "credits": 500,
    "reputation": {
      "outer_rim_settlers": 40
    },
    "items": [
      {
        "itemId": "kinrath_eggs",
        "quantity": 3
      },
      {
        "itemId": "settler_gift",
        "quantity": 1
      }
    ],
    "unlocks": []
  },
  "questGiverId": "npc_dantooine_farmer",
  "startLocation": {
    "planet": "dantooine",
    "area": "settlement"
  },
  "estimatedTime": 60,
  "difficulty": "medium",
  "isActive": true,
  "chainId": null,
  "chainOrder": null
}



